{
  "schema_version": "1.0",
  "receipt_id": "v73-v13-demo-lock-fixture",
  "test_path": "tests/test_v13_architecture_integrity_regressions.py",
  "from_sha256": "0ddb569bcd018b303250d9e70bf5f5d417ea8f91cd5e546203c751b67de6a721",
  "to_sha256": "5de40039a499936c4b3fc320065d5d730d08075ce4b53275124c6905ee911809",
  "reason": "The architecture fixture now includes the generated case lock so its frozen demo snapshot matches the current demo builder and verifier inventory.",
  "replacement_tests": [
    {"path": "tests/test_v72_demo_live_evidence.py", "sha256": "b5562d7c066c47fd9465fa079804eb6da7adcd80701f677be3f968333b30225c"}
  ],
  "evidence": [
    {"path": "evals/raw/v72-red/demo-live-evidence-red.md", "sha256": "96e9df0c0ee2ddef690c656e4670e904b2947220549f86a19e7275ee9e41a1dc"}
  ],
  "reviewed_by": "codex-r73-demo-lock-compatibility",
  "reviewed_at": "2026-08-07T09:00:01+10:00"
}
