{
  "evidence": [
    {
      "path": "evals/raw/v38-red/file-backed-audit-receipts.md",
      "sha256": "9c09872ad02013d19eb6526d095bc0e15a5a6808c9ae3e9bdee9bca3bdadcb3a"
    }
  ],
  "from_sha256": "0f2e85f9dba5a29ef5c441099cc8f9023e6e22741cca543532e1d1748f96638b",
  "reason": "Audit-integrity regression fixtures now use real isolated evidence files so negative tests cannot pass while hiding a second fake-hash bypass.",
  "receipt_id": "v38-v13-file-backed-audit-fixtures",
  "replacement_tests": [
    {
      "path": "tests/test_v38_file_backed_audit_receipts.py",
      "sha256": "60bc5e69e582227bc417741732c324ef947b0cb8181c1acaacca184dd7fc8f1e"
    }
  ],
  "reviewed_at": "2026-08-06T12:10:00Z",
  "reviewed_by": "independent-release-evidence-audit-v38",
  "schema_version": "1.0",
  "test_path": "tests/test_v13_architecture_integrity_regressions.py",
  "to_sha256": "6bf238ef14b10c534c97b035b46b6862fbdc596efe7a3951e10b5722d4da9f0d"
}
