{
  "schema_version": "1.0",
  "receipt_id": "v73-v37-demo-lock-fixture",
  "test_path": "tests/test_v37_release_completed_run_binding.py",
  "from_sha256": "e0bdb633d16f6198617b4387761709b7b6435179320a1de8f370e8a6bbf81cec",
  "to_sha256": "cd8b7cbf388cd51fcc8e6474c112ad403f5b7fabe83a845f38dd5244d3c65daf",
  "reason": "The completed-run fixture now includes the case lock emitted and verified by the current deterministic demo contract, preserving exact artifact binding coverage.",
  "replacement_tests": [
    {"path": "tests/test_v72_demo_live_evidence.py", "sha256": "b5562d7c066c47fd9465fa079804eb6da7adcd80701f677be3f968333b30225c"}
  ],
  "evidence": [
    {"path": "evals/raw/v72-red/demo-live-evidence-red.md", "sha256": "96e9df0c0ee2ddef690c656e4670e904b2947220549f86a19e7275ee9e41a1dc"}
  ],
  "reviewed_by": "codex-r73-demo-lock-compatibility",
  "reviewed_at": "2026-08-07T09:00:04+10:00"
}
