{
  "schema_version": "1.0",
  "receipt_id": "v74-v8-user-confirmation",
  "test_path": "tests/test_v8_time_integrity.py",
  "from_sha256": "b854364d4df218cab5a9a7db842348e329916f506bcdf89a3a361c8aa923cf56",
  "to_sha256": "9776f5d23496c1d15a9155cca955bb177e734a354a4141aa77b1d75e42a899f7",
  "reason": "Clock and replay fixtures now pass a valid file-backed confirmation to start so malformed and out-of-order clock tests continue to reach the intended clock admission layer.",
  "replacement_tests": [
    {"path": "tests/test_v74_operator_product_contract.py", "sha256": "947ba00444bd7ac6bd65dacab2abb7159e14dccebbcc05e12d086628fac9aed9"}
  ],
  "evidence": [
    {"path": "evals/raw/v74-red/operator-first-install-product-contract.md", "sha256": "6f5e25ef94702e6b240013f3d52c9be0eb340f74a54d34a3e21b8ebadfbd7445"}
  ],
  "reviewed_by": "codex-r74-confirmation-migration-b",
  "reviewed_at": "2026-08-07T10:00:00+10:00"
}
