{
  "schema_version": "1.0",
  "receipt_id": "v74-identity-label-case-confirmation-file",
  "test_path": "tests/test_identity_label_case.py",
  "from_sha256": "236e418d1a98b74b8ca1bbdde615475d4e49842a5ec2dc93435f0f8091d9ea36",
  "to_sha256": "2a89d2a30d21ef38375c59dbe53044a2f7bacd7a100f0214ae1122710debef95",
  "reason": "The successful lifecycle fixture now supplies a non-empty UTF-8 file containing the user's explicit confirmation before start, matching the stricter file-backed consent boundary without changing the lifecycle assertions.",
  "replacement_tests": [
    {
      "path": "tests/test_v74_operator_product_contract.py",
      "sha256": "947ba00444bd7ac6bd65dacab2abb7159e14dccebbcc05e12d086628fac9aed9"
    }
  ],
  "evidence": [
    {
      "path": "evals/raw/v74-red/operator-first-install-product-contract.md",
      "sha256": "6f5e25ef94702e6b240013f3d52c9be0eb340f74a54d34a3e21b8ebadfbd7445"
    }
  ],
  "reviewed_by": "codex-r74-confirmation-migration-a",
  "reviewed_at": "2026-08-07T10:00:00+10:00"
}
