{
  "schema_version": "1.0",
  "receipt_id": "v74-v7-audit-user-confirmation",
  "test_path": "tests/test_v7_audit_regressions.py",
  "from_sha256": "0c4e3908bfb771d2e87feb9ed0a3412c9f2fb72a1b263c3b30d70ea48b188091",
  "to_sha256": "79af8ee1d4c206a2cb2fd5a85b9ae301d58feede723d37350ff591ee3a7640a6",
  "reason": "Temporal lifecycle fixtures now bind explicit user confirmation before measuring elapsed experiment windows, leaving the original time-window assertions unchanged.",
  "replacement_tests": [
    {"path": "tests/test_v74_operator_product_contract.py", "sha256": "947ba00444bd7ac6bd65dacab2abb7159e14dccebbcc05e12d086628fac9aed9"}
  ],
  "evidence": [
    {"path": "evals/raw/v74-red/operator-first-install-product-contract.md", "sha256": "6f5e25ef94702e6b240013f3d52c9be0eb340f74a54d34a3e21b8ebadfbd7445"}
  ],
  "reviewed_by": "codex-r74-confirmation-migration-b",
  "reviewed_at": "2026-08-07T10:00:00+10:00"
}
