{
  "schema_version": "1.0",
  "receipt_id": "v74-v10-state-confirmation-file",
  "test_path": "tests/test_v10_state_transaction_regressions.py",
  "from_sha256": "2ff9960dba02e89d141b3ee52ac603623de4e3343066187276366cae4da59f90",
  "to_sha256": "6b83c8ee33f4c429848132738edc97057da237ad08b587c51612f27d7185fff1",
  "reason": "The concurrent-writer setup now uses a non-empty UTF-8 user-confirmation file for the successful start transition; transaction-failure and concurrency assertions still test their original targets.",
  "replacement_tests": [
    {
      "path": "tests/test_v74_operator_product_contract.py",
      "sha256": "947ba00444bd7ac6bd65dacab2abb7159e14dccebbcc05e12d086628fac9aed9"
    }
  ],
  "evidence": [
    {
      "path": "evals/raw/v74-red/operator-first-install-product-contract.md",
      "sha256": "6f5e25ef94702e6b240013f3d52c9be0eb340f74a54d34a3e21b8ebadfbd7445"
    }
  ],
  "reviewed_by": "codex-r74-confirmation-migration-a",
  "reviewed_at": "2026-08-07T10:00:00+10:00"
}
