{
  "schema_version": "1.0",
  "receipt_id": "v73-v39-demo-lock-fixture",
  "test_path": "tests/test_v39_runtime_schema_enforcement.py",
  "from_sha256": "233b966d805349f3d59c4aaeee1e971fd42aa5a43837c2fe3f1f3c9e5e1ee81c",
  "to_sha256": "1f095e418c82aae0c824709421d6eb9d9e0d6f7164c37ee5837868b41c4f0288",
  "reason": "The runtime schema fixture now materializes the current demo case lock so freeze-time artifact collection exercises the same inventory as the real builder and verifier.",
  "replacement_tests": [
    {"path": "tests/test_v72_demo_live_evidence.py", "sha256": "b5562d7c066c47fd9465fa079804eb6da7adcd80701f677be3f968333b30225c"}
  ],
  "evidence": [
    {"path": "evals/raw/v72-red/demo-live-evidence-red.md", "sha256": "96e9df0c0ee2ddef690c656e4670e904b2947220549f86a19e7275ee9e41a1dc"}
  ],
  "reviewed_by": "codex-r73-demo-lock-compatibility",
  "reviewed_at": "2026-08-07T09:00:05+10:00"
}
