{
  "schema_version": "1.0",
  "receipt_id": "v73-v11-demo-lock-fixture",
  "test_path": "tests/test_v11_evolution_controller.py",
  "from_sha256": "02a68218131876777d22c86952af571e88958586d33d2a3f74d1e285d7fe9c75",
  "to_sha256": "7cae032c36e31ea11d76bfe1788f7ffe7741932e5484ff4ad1761dffe4e74e85",
  "reason": "The shared evolution fixture now creates the demo lock that the runtime demo builder and verifier publish and bind as part of the current deterministic demo inventory.",
  "replacement_tests": [
    {"path": "tests/test_v72_demo_live_evidence.py", "sha256": "b5562d7c066c47fd9465fa079804eb6da7adcd80701f677be3f968333b30225c"}
  ],
  "evidence": [
    {"path": "evals/raw/v72-red/demo-live-evidence-red.md", "sha256": "96e9df0c0ee2ddef690c656e4670e904b2947220549f86a19e7275ee9e41a1dc"}
  ],
  "reviewed_by": "codex-r73-demo-lock-compatibility",
  "reviewed_at": "2026-08-07T09:00:00+10:00"
}
