{
  "schema_version": "1.0",
  "receipt_id": "v74-final-forward-confirmation-file",
  "test_path": "tests/test_final_forward_regressions.py",
  "from_sha256": "4f6ccda5de094977a6f7d73d5e8f3fc01d7b7d5aa662b5f14a104bad58460dad",
  "to_sha256": "8e2d65038a22abe20e73d766aee25828a7c3f32cfa031bbb8191f1c53bf6b1f8",
  "reason": "The task-duration workflow fixture now records the user's exact non-empty confirmation in a UTF-8 file and binds that file to start; duration, review, and negative-boundary checks remain unchanged.",
  "replacement_tests": [
    {
      "path": "tests/test_v74_operator_product_contract.py",
      "sha256": "947ba00444bd7ac6bd65dacab2abb7159e14dccebbcc05e12d086628fac9aed9"
    }
  ],
  "evidence": [
    {
      "path": "evals/raw/v74-red/operator-first-install-product-contract.md",
      "sha256": "6f5e25ef94702e6b240013f3d52c9be0eb340f74a54d34a3e21b8ebadfbd7445"
    }
  ],
  "reviewed_by": "codex-r74-confirmation-migration-a",
  "reviewed_at": "2026-08-07T10:00:00+10:00"
}
