{
  "evidence": [
    {
      "path": "evals/raw/v37-red/release-completed-run-binding.md",
      "sha256": "d306a42d8d260fa90f2691819e1812b9abc86369f62c3aded3f1d4533bdf2f54"
    }
  ],
  "from_sha256": "8a5183d53c3e09f0c564a6caf38d4402c5c4802137a9b1c94c6a91fb28a5fd39",
  "reason": "Governance freeze tests must execute and bind the workflow first; workflow drift is now rejected by completed-run revalidation instead of only a snapshot invalidation.",
  "receipt_id": "v37-v14-governance-freeze-binding",
  "replacement_tests": [
    {
      "path": "tests/test_v37_release_completed_run_binding.py",
      "sha256": "e0bdb633d16f6198617b4387761709b7b6435179320a1de8f370e8a6bbf81cec"
    }
  ],
  "reviewed_at": "2026-08-06T12:00:00Z",
  "reviewed_by": "independent-state-integrity-audit-v37",
  "schema_version": "1.0",
  "test_path": "tests/test_v14_evolution_lineage_and_governance.py",
  "to_sha256": "f39365253785b9caa3af016621400757ec97c3651ac41d8ebbd204283231fb2a"
}
