{
  "schema_version": "1.0",
  "receipt_id": "v73-v18-frozen-command-semantics-and-demo-lock",
  "test_path": "tests/test_v18_workflow_command_binding.py",
  "from_sha256": "711023d08d61b43f20ee641ec1dc520ede93888ea1888b9b3bdc14521295f9ab",
  "to_sha256": "f167d21d6f0e77625df60dc5a41567f43a2cda9cabec2c3520b81ef6eb9a3e81",
  "reason": "Historical command receipts now verify against immutable script and input snapshots, while later live command drift invalidates the current candidate governance tree rather than corrupting the historical run. The fixture also includes the current demo lock.",
  "replacement_tests": [
    {"path": "tests/test_v72_evolution_loop_terminal_contracts.py", "sha256": "30e4573d7b47e5234e9ba6435b66fad6b4efbde3b2a2086ca0ea316e765cbca1"},
    {"path": "tests/test_v72_demo_live_evidence.py", "sha256": "b5562d7c066c47fd9465fa079804eb6da7adcd80701f677be3f968333b30225c"}
  ],
  "evidence": [
    {"path": "evals/raw/v72-red/evolution-loop-terminal-contracts.md", "sha256": "003515ae17e73aacb74ab8d714234f4645c293f73d746e9567240ddcb14860e6"},
    {"path": "evals/raw/v72-red/demo-live-evidence-red.md", "sha256": "96e9df0c0ee2ddef690c656e4670e904b2947220549f86a19e7275ee9e41a1dc"}
  ],
  "reviewed_by": "codex-r73-frozen-command-compatibility",
  "reviewed_at": "2026-08-07T09:00:03+10:00"
}
